{"artifact_hashes":{"config/pilot_design_r14_v375.json":"476899f14094afe419c42b4e5e8bddff765f03e72c5384de9fe42bdad084281b","reports/step_04_r14_OWNER_RUNBOOK.md":"083c675382a20d4733669d580d132f497327813789984c0c63c5e37b3e3eccac","reports/step_04_r14_pilot_report_v375.json":"7ac6839c11a952ad9970b96986a1bade16f96c715cd45c8c3967b8e0da5d0a27","reports/step_04_r14_pilot_report_v375.md":"6762bdf631590b1967f828f6b2c2b29aa7c5e9af6251acc0c94e0cb01cb9c8c0","runs/kdenv375-s04-ordinary-20260914T220000Z-r14-confirmation-pilot/pilot/benchmark_segments":"d12b396e052ae928159336e671cb22801921a98f8c2dc3188fa9c0acc0b9a16d","runs/kdenv375-s04-ordinary-20260914T220000Z-r14-confirmation-pilot/pilot/manifests":"ea04189e97205335719dbb91a7585bb37a5cda2537546c1d8eb7144b2307a91b","runs/kdenv375-s04-ordinary-20260914T220000Z-r14-confirmation-pilot/pilot/precision":"6f49dbca2983c1c816c617f1cfb254a405a1e72e0e0534b6ab8f39bbd806564b","runs/kdenv375-s04-ordinary-20260914T220000Z-r14-confirmation-pilot/pilot/primary":"25d1bb32db48fed48cb3ae88336ab3eb5d6260d1f9a1cf06cfa9a84154375b25","runs/kdenv375-s04-ordinary-20260914T220000Z-r14-confirmation-pilot/pilot/progress":"f53c408979da434f982f4bfc821e6d5d35ce48113a9f08a8b5382dff10a66d31","runs/kdenv375-s04-ordinary-20260914T220000Z-r14-confirmation-pilot/pilot/rebuild":"9bfb35b29b7d3540e3574113d9f1f28978004fb6f254544a8eece057f5368ce7","runs/kdenv375-s04-ordinary-20260914T220000Z-r14-confirmation-pilot/pilot/reports":"168d6f322504ef388028cf88dd1ad9c53d6ac610233a49c04fcabe7b5ca491bc","runs/kdenv375-s04-ordinary-20260914T220000Z-r14-confirmation-pilot/pilot/selection":"9cca5742313ba796b0cfed6f851af5d03c37780308e99e1a506d9b6ca5c6873f","schemas/r14_step04_pass_v375.json":"f1a2c0e3fc8eeaea6ffd51105f2378b347b432d03d87e16f075117fc855694d9","src/kden_v375/execution.py":"fafb1352b7ebaa49ebe73756d313e5c44af913a0affaf4d742cf4243b88e5f23","src/kden_v375/io/cache.py":"7be8f180d1b53bb6bb406a803b1311bb2df7bc9d89b2033b6e3a51d70a07979c","src/kden_v375/io/grib.py":"5559d3e20cdca3125367e05499dbbe61816bdbbc86dd6b9fe2deb2cd232c2592","src/kden_v375/io/http_range.py":"d16ad97e291e2b48ce66c6b831c35292b3de58ed98f2735f4c3558dc6b5ced95","src/kden_v375/pilot.py":"d391232c6980634f4e17987c51522c7ddbb3b651a281de13c93f78111903b4e9","src/kden_v375/progress.py":"a7230d3f460396f880fb2854feadeb05164ebd2fc81d3403112e595fff2f4199","src/kden_v375/r14_pilot_records.py":"8ccaf7f2cb86a6122d6474c29602c26b356dae4956efda1579cd9058765fc74c","src/kden_v375/steps/step_04_pilot.py":"cba783a7cc6c757c6dc73c78eaaccd8bc15ddfe4a265300fff2bd4fab2f48e52"},"completed_at_utc":"2026-09-14T20:55:19.012882Z","gate_evidence":{"all_r14_regional_operators_validated":true,"dynamic_regional_supports_have_finite_h14":true,"eight_worker_end_to_end_primary_complete":true,"every_selector_validated_or_explicitly_blocked":true,"excluded_h_and_q_identities_absent":true,"float32_comparison_completed_and_within_tolerance":true,"h14_terrain_finite_for_both_coordinate_eras":true,"h16_q05_spatial_parity":true,"h38_fh00_and_positive_lead_intervals":true,"interruption_resume_duplicate_and_change_free":true,"no_ambiguous_repeated_q15_block_accepted":true,"no_full_grid_cells_persisted":true,"physical_value_ranges_and_units":true,"pilot_rebuild_value_identical_and_hash_stable":true,"projected_disk_fits_with_safety_margin":true,"q05_repeated_blocks_resolve_by_full_identity":true},"predecessor_hashes":{"STEP_01_R14":"f53a94ffb1936a9b68f9a455ccc64531b08246f3eb6df0229a2d255f5641ee41","STEP_02_R14":"41c96a557cb829ffd456e117810eb9bd38857025005c4457df4a413363166e6f","STEP_03_R14":"7a78c5ea584009f5d3577059d178cd80f61d863b6b1a35f3210756c6d91d4c57"},"record_id":"STEP_04_R14","record_sha256":"6462b5af4846acc6aef13d0f6d7ff440ef44e9b5cfc436a906606f627079e9bc","run_id":"kdenv375-s04-ordinary-20260914T220000Z-r14-confirmation-pilot","schema_version":"KDEN_V375_R14_STEP04_PASS_V1","scope_id":"KDEN_V375_R14_V1","status":"PASS"}
